{
  "_schemaVersion": "v1.0.0",
  "timer": {
    "shortname": "livesplit",
    "longname":  "LiveSplit",
    "version":   "v1.6.0"
  },
  "game":     {"longname": "Super Mario Odyssey"},
  "category": {"longname": "Any%"},
  "segments": [
    {
      "name":         "Cap",
      "endedAt":      {"realtimeMS": 143123},
      "bestDuration": {"realtimeMS": 141167}
    }
  ]
}
